"RANK";"PRODUCT CODE";"PRODUCT DESCRIPTION";"RCA";"PCI";"RELATEDNESS DENSITY";"OPPORTUNITY GAIN (Z-SCORE)";"PGI (Z-SCORE)";"ECONOMIC BENEFIT SCORE"
1;8605;"Railway or tramway coaches; passenger coaches, luggage vans, post office coaches and other special purpose railway or tramway coaches, not self-propelled (excluding those of heading no. 8604)";0,0292307106608605;0,794566070411241;0,142350505995813;1,03948778004492;-2,45745112914173;1,0507922241376
2;3908;"Polyamides in primary forms";0,0102012379613918;1,56085532960011;0,130151745912621;1,66656756752366;-2,05966138431833;1,0175889321297
3;3002;"Blood, human or animal; for therapeutic, prophylactic or diagnostic uses; antisera, other blood fractions, modified immunological products, (from biotechnological processes or not); vaccines, toxins, micro-organism cultures (not yeasts), similar products";0,0225686519274095;1,56445781411057;0,13004628887232;1,82822093658668;-1,49469280334714;0,882202759377735
4;3911;"Petroleum resins, coumarone-indene resins, polyterpenes, polysulphides, polysulphones and similar products of chemical synthesis n.e.c. in chapter 39, in primary forms";0,0343183495653193;1,38463398042871;0,124413362773405;1,84882328591869;-1,50854041332984;0,843061564219828
5;7220;"Stainless steel; flat-rolled products of width less than 600mm";0,363429192658133;1,55958427731328;0,13029876639523;1,94825832353383;-1,23930026153582;0,839353453033928
6;2910;"Epoxides, epoxyalcohols, epoxyphenols and epoxyethers; with a three-membered ring and their halogenated, sulphonated, nitrated or nitrosated derivatives";0,016176713918562;1,69258130589672;0,125546249935075;1,75500833180416;-1,55065715496185;0,836010366838601
7;8208;"Knives and cutting blades, for machines or for mechanical appliances";0,337228131272504;1,5145869231904;0,127777572793618;1,952795756685;-1,19905215402438;0,804791297786227
8;8439;"Machinery; for making pulp of fibrous cellulosic material, or for making or finishing paper or paperboard";0,0302986523113241;1,51690202701298;0,12078675467438;1,62018300295377;-1,71125052620438;0,801824940650241
9;8202;"Tools, hand; blades for saws of all kinds (including slitting, slotting or toothless blades)";0,210375717151816;1,70338512326378;0,106881694764852;1,78155377932432;-1,92123395676559;0,80064142699993
10;7225;"Alloy steel flat-rolled products, of a width 600mm or more";0,0288430011323553;1,38862301172028;0,130653963705603;1,79127773300854;-1,26715508542898;0,79950377784122
11;3403;"Lubricating preparations and those used in oil or grease treatment of textile and similar materials; excluding preparations containing 70% or more (by weight) of petroleum or bituminous mineral oils";0,306282446147854;1,28943557362485;0,140448373428791;1,62083724427486;-1,12436152052599;0,783117235147692
12;7223;"Stainless steel wire";0,094464702570935;2,03745069062381;0,113561638041201;2,25215265508562;-1,09865680856936;0,74334965621722
13;4806;"Vegetable parchment, greaseproof papers, tracing papers, glassine and other glazed transparent or translucent papers, in rolls or sheets";0,0742369980292298;1,29821622832021;0,120532252714376;1,41122800000589;-1,73222541294141;0,736877629180156
14;8515;"Electric (electrically heated gas) soldering, brazing, welding machines and apparatus, capable or not of cutting, electric machines and apparatus for hot spraying of metals or sintered carbides";0,308720919431056;1,61658468003721;0,124374357291872;1,94458218892239;-1,09236626455187;0,735905930282223
15;8401;"Nuclear reactors; fuel elements (cartridges), non-irradiated, for nuclear reactors, machinery and apparatus for isotopic separation";0,00708602744901055;1,06433258540529;0,134705122738571;1,2646124342127;-1,47077897783258;0,728232087952812
16;3810;"Metal-pickling preparations; fluxes etc for soldering, brazing; welding powders, pastes of metal and other materials; preparations used as cores or coatings for welding electrodes or rods";0,311361258713532;2,01582376979526;0,109964961151733;2,21459287723333;-1,16982773237478;0,722229137257749
17;2926;"Nitrile-function compounds";0,00987013733953855;1,71735950121271;0,11657571416793;2,10495338317572;-1,07084318459235;0,712100279842998
18;8603;"Railway or tramway coaches, vans and trucks; self-propelled tenders, other than those of heading no. 8604";8,53116404814698e-05;0,804180357280668;0,137818000534322;1,13494700128263;-1,45452408514807;0,707568190299934
19;9027;"Instruments and apparatus; for physical or chemical analysis (e.g. polarimeters, spectrometers), for measuring or checking viscosity, porosity, etc, for measuring quantities of heat, sound or light";0,167873466296623;1,66719453386976;0,126470612315891;1,8741914108563;-1,00821735126498;0,703232267738907
20;8608;"Railway or tramway track fixtures and fittings; mechanical (including electro-mechanical) signalling, safety or traffic control equipment for railways, tramways, roads, inland waterways, parking facilities, port installations or airfields; parts thereof";0,47993688453518;0,785544880762916;0,149955132582232;1,03001593308577;-1,131021193418;0,673836309992213
21;8420;"Machines; calendering or other rolling machines, for other than metal or glass and cylinders therefor";0,195171103702645;1,85833435673656;0,112551999538457;2,09128667721849;-1,05026139937945;0,66452198692518
22;5906;"Textile fabrics, rubberised; other than those of heading no. 5902";0,195560069431289;1,07618141141731;0,135650455073145;1,389649364655;-1,10445712211095;0,656299717524593
23;3909;"Amino-resins, phenolic resins and polyurethanes, in primary forms";0,0780438900873847;1,16435439083355;0,130835632583932;1,28806004076521;-1,29053601307335;0,641190893263393
24;8428;"Lifting, handling, loading or unloading machinery; n.e.c. in heading no. 8425, 8426 or 8427 (e.g. lifts, escalators, conveyors, teleferics)";0,187788933275092;1,00088396579708;0,144083749440479;1,08423624464626;-1,09328834877594;0,626564544317108
25;7226;"Alloy steel flat-rolled products, of a width of less than 600mm";0,0185941728944732;1,36470026135955;0,121045771142256;1,6921161901333;-1,0938846523773;0,622341890844942
26;5910;"Textiles; transmission or conveyor belts or belting, of textile material, whether or not impregnated, coated, covered or laminated with plastics, or reinforced with metal or other material";0,274990719262854;1,12293472198788;0,132173729481957;1,33127450682248;-1,14493034323893;0,619086303314776
27;7506;"Nickel; plates, sheets, strip and foil";0,392366615499006;1,88524798349577;0,118791091863238;1,60358015596761;-1,21522114681605;0,613012011313514
28;8406;"Turbines; steam and other vapour turbines";0,0928167699640194;1,07222995735331;0,124090557154609;1,41288643544089;-1,21600253180274;0,597335518762771
29;8487;"Machinery parts; not containing electrical connectors, insulators, coils, contacts or other electrical features, n.e.c. in this chapter";0,116553088534468;1,17849723875134;0,131371588568621;1,35792401104881;-1,07334699283313;0,596899313686694
30;8433;"Harvesting and threshing machinery, straw and fodder balers, grass or hay mowers; machines for cleaning, sorting or grading eggs, fruit or other agricultural produce, other than machinery of heading no 8437";0,158408940686058;0,911601241870022;0,144594469003877;1,00083244707912;-1,04051277200562;0,585761383920234
31;8426;"Derricks, cranes, including cable cranes, mobile lifting frames, straddle carriers and works trucks fitted with a crane";0,266385100057806;0,816490141141082;0,127131507783855;1,31975595707384;-1,17055606272627;0,578472986408361
32;8465;"Machine-tools; (including machines for nailing, stapling, glueing or otherwise assembling) for working wood, cork, bone, hard plastics or rubber or similar hard materials";0,0792866087163508;1,42143038284234;0,114087880444413;1,501482841687;-1,33471504679351;0,576541936516373
33;5502;"Artificial filament tow";0,38350604579771;0,62796737790498;0,130067262159425;1,16217363371334;-1,22432027222418;0,570251306886264
34;9012;"Microscopes (excluding optical microscopes); diffraction apparatus";0,0251611257792489;1,92439993498601;0,108015158065228;1,47163373858907;-1,39109117480357;0,530807204116358
35;2934;"Nucleic acids and their salts, whether or not chemically defined; other heterocyclic compounds";0,023338277260257;1,3962868328265;0,126158243557374;1,26325556785902;-1,04599002889741;0,50937054316746
36;9011;"Microscopes, compound optical; including those for microphotography, microcinematography or microprojection";0,089224204334891;1,5383276987584;0,11512213277085;1,45062507880185;-1,086338694713;0,486092315720497
37;2842;"Salts of inorganic acids or peroxoacids, excluding azides, n.e.c.";0,0866521744995215;1,43888214205501;0,104054513006769;1,47032835379172;-1,33517852532846;0,476139218831479
38;7607;"Aluminium foil (whether or not printed or backed with paper, paperboard, plastics or similar backing materials) of a thickness (excluding any backing) not exceeding 0.2mm";0,367327480956128;0,724567923610276;0,129171558748654;1,01392122486641;-1,07451479834456;0,462848768856626
39;3701;"Photographic plates and film in the flat, sensitised, unexposed, of any material other than paper, paperboard or textiles; instant print film in the flat, sensitised, unexposed, whether or not in packs";0,0607056954328337;1,25455715745433;0,118268022256289;1,3326432997186;-1,04970140568443;0,462825521542457
40;8446;"Weaving machines (looms)";0,042635958731425;1,62057752341737;0,105993764934094;1,65952658055009;-1,04808661068318;0,460936531367022
41;8486;"Machines and apparatus of a kind used solely or principally for the manufacture of semiconductor boules or wafers, semiconductor devices, electronic integrated circuits or flat panel displays; machines and apparatus specified in note 9-C to this Chapter";0,00135612390547454;2,15057485435351;0,110802145265902;1,52750460908346;-1,02030030623153;0,450881222067369
42;8507;"Electric accumulators, including separators therefor; whether or not rectangular (including square)";0,153000868485335;1,25858104490235;0,108418730114149;1,04955896149962;-1,30802300556738;0,366053224893516
43;2924;"Carboxyamide-function compounds; amide-function compounds of carbonic acid";0,0118085739064887;1,26116355599916;0,109419149312774;1,17154847766405;-1,07029028744381;0,336463174989475
