"year";"country_iso3";"prod_code";"prod_descr";"sector";"X_cp";"gini";"gini_year";"hs2";"tot_exp_c";"tot_exp_p";"tot_world_exp";"RCA_cp";"s_cp";"M_cp";"diversity_c";"ubiquity_p";"eci_c";"pci_p";"dens_cp";"coi_c";"cog_cp";"PGI_p";"PGI_Z";"DENS_Z";"COG_Z";"EBS"
2024;"ZAF";5607;"Twine, cordage, ropes and cables, whether or not plaited or braided; whether or not impregnated, coated, covered or sheathed with rubber or plastics";"Wadding, felt and nonwovens, special yarns; twine, cordage, ropes and cables and articles thereof";10445,516;63;2014;56;155041390,38;2852436,267;22733684200,976;0,536952807497493;6,73724350278237e-05;0;167;36;-0,0670669125439501;-0,822253196551697;0,172046129515247;-3,55265424216155;-0,226681985830461;37,8754083906499;0,853376018179009;0,45608373823154;-1,4979977550447;-0,63176334499739
2024;"ZAF";5608;"Twine, cordage or rope; knotted netting, made up fishing nets and other made up nets, of textile materials";"Wadding, felt and nonwovens, special yarns; twine, cordage, ropes and cables and articles thereof";4696,15;63;2014;56;155041390,38;1919767,265;22733684200,976;0,358686925670831;3,02896535466428e-05;0;167;30;-0,0670669125439501;-0,570700636256908;0,155115429627399;-3,55265424216155;-0,171219253630188;35,4709104784633;0,148983748775833;-0,000397558090078399;-1,23808359665286;-0,462488301172923
2024;"ZAF";5609;"Articles of yarn, strip or the like of heading no. 5404 or 5405; twine, cordage, rope or cables n.e.c. or included";"Wadding, felt and nonwovens, special yarns; twine, cordage, ropes and cables and articles thereof";1075,338;63;2014;56;155041390,38;817790,241;22733684200,976;0,192808083515814;6,93581241347482e-06;0;167;25;-0,0670669125439501;-0,512080938181213;0,151495664297773;-3,55265424216155;-0,115998183011888;34,5380139464806;-0,124306197516564;-0,0979927656711719;-0,979301933257242;-0,31766283380395
2024;"ZAF";5701;"Carpets and other textile floor coverings; knotted, whether or not made up";"Carpets and other textile floor coverings";1144,799;63;2014;57;155041390,38;872982,52;22733684200,976;0,192285201647147;7,38382826156387e-06;0;167;15;-0,0670669125439501;-0,902586545961315;0,167131190298304;-3,55265424216155;-0,119911625345717;30,3120751492356;-1,36228548818824;0,323568376199612;-0,997641438547736;0,229404141946705
2024;"ZAF";5702;"Carpets and other textile floor coverings; woven, (not tufted or flocked), whether or not made up, including kelem, schumacks, karamanie and similar hand-woven rugs";"Carpets and other textile floor coverings";6144,237;63;2014;57;155041390,38;5532123,923;22733684200,976;0,162853924088843;3,96296562159352e-05;0;167;21;-0,0670669125439501;-1,01544599619317;0,171920719207055;-3,55265424216155;-0,161507652500256;35,2176394369524;0,0747885653241211;0,452702456864864;-1,19257226797888;-0,271552792146044
2024;"ZAF";5703;"Carpets and other textile floor coverings; tufted, whether or not made up";"Carpets and other textile floor coverings";17469,925;63;2014;57;155041390,38;7192797,415;22733684200,976;0,356135593119533;0,000112679104316479;0;167;23;-0,0670669125439501;-0,38447202729205;0,153648177556807;-3,55265424216155;-0,020197499472631;32,7993012142597;-0,633658191994081;-0,0399572414848061;-0,530352646994943;0,021116101171444
2024;"ZAF";5704;"Carpets and other textile floor coverings; of felt, (not tufted or flocked), whether or not made up";"Carpets and other textile floor coverings";2276,48;63;2014;57;155041390,38;643694,1;22733684200,976;0,518568914016216;1,46830468587804e-05;0;167;18;-0,0670669125439501;0,218863703404422;0,142640234605153;-3,55265424216155;0,165178030988627;30,4238085584594;-1,3295534366059;-0,336750646464601;0,33836988207734;0,44372422407288
2024;"ZAF";5705;"Carpets and other textile floor coverings; n.e.c. in chapter 57, whether or not made up";"Carpets and other textile floor coverings";4007,364;63;2014;57;155041390,38;1966431,765;22733684200,976;0,298814783446902;2,58470592283655e-05;0;167;16;-0,0670669125439501;-0,534364320033518;0,141935536494599;-3,55265424216155;-0,0281445336268331;36,8331568524843;0,548050768139691;-0,355750540689409;-0,567594712287401;-0,490465340372167
2024;"ZAF";5801;"Fabrics; woven pile and chenille fabrics, other than fabrics of heading no. 5802 or 5806";"Fabrics; special woven fabrics, tufted textile fabrics, lace, tapestries, trimmings, embroidery";427,858;63;2014;58;155041390,38;2239138,945;22733684200,976;0,0280182355142881;2,75963727460995e-06;0;167;12;-0,0670669125439501;0,486304596784811;0,122078229098104;-3,55265424216155;0,19630274275116;35,5040931020597;0,15870452392035;-0,891138296768822;0,484229145442439;-0,188537891748911
2024;"ZAF";5804;"Tulles and other net fabrics; not including woven, knitted or crocheted fabrics; lace in the piece, in strips or in motifs, (other than fabrics of headings 60.02 to 60.06)";"Fabrics; special woven fabrics, tufted textile fabrics, lace, tapestries, trimmings, embroidery";355,59;63;2014;58;155041390,38;1314411,557;22733684200,976;0,0396680031047991;2,29351658372299e-06;0;167;15;-0,0670669125439501;-0,489262961338844;0,128322317051895;-3,55265424216155;0,0276257184251814;37,9946556588104;0,888309237881142;-0,722786758889485;-0,306239428291328;-0,639111808353985
2024;"ZAF";5806;"Fabrics; narrow woven, other than goods of heading no. 5807; narrow fabrics consisting of warp without weft assembled by means of an adhesive (bolducs)";"Fabrics; special woven fabrics, tufted textile fabrics, lace, tapestries, trimmings, embroidery";10307,497;63;2014;58;155041390,38;4259728,212;22733684200,976;0,354808074981767;6,648222758282e-05;0;167;20;-0,0670669125439501;-0,0324240766619158;0,128246232695792;-3,55265424216155;0,0255399698340445;38,4633367306987;1,02560830650601;-0,724838126271446;-0,316013840192365;-0,68882009098994
2024;"ZAF";5807;"Labels, badges and similar articles; of textile materials, in the piece, in strips or cut to shape or size, not embroidered";"Fabrics; special woven fabrics, tufted textile fabrics, lace, tapestries, trimmings, embroidery";4716,576;63;2014;58;155041390,38;1203966,696;22733684200,976;0,574426585361567;3,04213990111922e-05;0;167;17;-0,0670669125439501;-0,526239538248984;0,123192158108292;-3,55265424216155;-0,0634944416896947;39,0438682191829;1,19567370376043;-0,861104821369152;-0,733254448814816;-0,930010991314799
2024;"ZAF";5810;"Embroidery; in the piece, in strips or in motifs";"Fabrics; special woven fabrics, tufted textile fabrics, lace, tapestries, trimmings, embroidery";380,654;63;2014;58;155041390,38;1547888,11;22733684200,976;0,0360589438256631;2,45517664068306e-06;0;167;14;-0,0670669125439501;-0,838519108994557;0,120192251949645;-3,55265424216155;-0,054034968577015;35,9675966761178;0,294486856170487;-0,94198754099761;-0,688924663833536;-0,641799687000544
2024;"ZAF";5901;"Textile fabrics, gum or amylaceous substance coated, used for outer book covers and like; tracing cloth, prepared painting canvas; buckram and similar stiffened textile fabrics used for hat foundation";"Textile fabrics; impregnated, coated, covered or laminated; textile articles of a kind suitable for industrial use";376,031;63;2014;59;155041390,38;508739,459;22733684200,976;0,108380311338624;2,42535879663078e-06;0;167;17;-0,0670669125439501;-1,12228164641344;0,127444750618968;-3,55265424216155;-0,0879558426180978;33,0467824370831;-0,561159122938645;-0,746447485590947;-0,847887539958497;-0,344391967536933
2024;"ZAF";5902;"Textile fabrics; tyrecord of high tenacity yarn of nylon or other polyamides polyesters or viscose rayon";"Textile fabrics; impregnated, coated, covered or laminated; textile articles of a kind suitable for industrial use";153,092;63;2014;59;155041390,38;2915007,032;22733684200,976;0,00770078606383103;9,87426645393065e-07;0;167;15;-0,0670669125439501;0,530490904064941;0,115722450089657;-3,55265424216155;0,140044915658501;33,0128436950467;-0,571101401283957;-1,06250122093193;0,220588945948796;-0,0902702912330583
2024;"ZAF";5903;"Textile fabrics impregnated, coated, covered or laminated with plastics, other than those of heading no. 5902";"Textile fabrics; impregnated, coated, covered or laminated; textile articles of a kind suitable for industrial use";11206,205;63;2014;59;155041390,38;12928843,582;22733684200,976;0,127092829945287;7,22787958269341e-05;0;167;14;-0,0670669125439501;1,08808151165162;0,111151130707713;-3,55265424216155;0,404922848383612;35,4286223530252;0,136595537293039;-1,18575199090557;1,46188237361878;0,0465116151400569
2024;"ZAF";5906;"Textile fabrics, rubberised; other than those of heading no. 5902";"Textile fabrics; impregnated, coated, covered or laminated; textile articles of a kind suitable for industrial use";2402,345;63;2014;59;155041390,38;1801263,97;22733684200,976;0,195560069431289;1,54948623339352e-05;0;167;15;-0,0670669125439501;1,07618141141731;0,135650455073145;-3,55265424216155;0,389509143886074;31,1921923720731;-1,10445712211095;-0,525207334192168;1,389649364655;0,656299717524593
2024;"ZAF";5907;"Textile fabrics; otherwise impregnated, coated or covered; painted canvas being theatrical scenery, studio back-cloths or the like";"Textile fabrics; impregnated, coated, covered or laminated; textile articles of a kind suitable for industrial use";1873,875;63;2014;59;155041390,38;782191,686;22733684200,976;0,351276898890172;1,20862886704461e-05;0;167;11;-0,0670669125439501;0,490633180003027;0,121167174134109;-3,55265424216155;0,202665726349126;33,4534463896824;-0,442027830287462;-0,915701932870078;0,514047898704622;0,0134579320406688
2024;"ZAF";5910;"Textiles; transmission or conveyor belts or belting, of textile material, whether or not impregnated, coated, covered or laminated with plastics, or reinforced with metal or other material";"Textile fabrics; impregnated, coated, covered or laminated; textile articles of a kind suitable for industrial use";1358,927;63;2014;59;155041390,38;724603,219;22733684200,976;0,274990719262854;8,76493042708999e-06;0;167;20;-0,0670669125439501;1,12293472198788;0,132173729481957;-3,55265424216155;0,377052611593929;31,0540338772558;-1,14493034323893;-0,618945940117086;1,33127450682248;0,619086303314776
2024;"ZAF";5911;"Textile products and articles for technical uses; specified in note 7 to this chapter";"Textile fabrics; impregnated, coated, covered or laminated; textile articles of a kind suitable for industrial use";15940,935;63;2014;59;155041390,38;5777897,339;22733684200,976;0,404544348337312;0,000102817286151327;0;167;23;-0,0670669125439501;1,19010734146838;0,135138240949437;-3,55265424216155;0,383179541476182;36,4386251096823;0,432473579132607;-0,539017523300315;1,3599870451468;0,129498647571293
2024;"ZAF";6001;"Fabrics; pile fabrics, including long pile fabrics and terry fabrics, knitted or crocheted";"Fabrics; knitted or crocheted";4908,582;63;2014;60;155041390,38;5941394,137;22733684200,976;0,121140637714295;3,16598166977816e-05;0;167;10;-0,0670669125439501;-0,640978860764713;0,135461877676049;-3,55265424216155;-0,053366909390194;36,5859785248963;0,475640431563995;-0,530291710812955;-0,685793948226675;-0,563908696867875
2024;"ZAF";6004;"Fabrics; knitted or crocheted fabrics of a width exceeding 30 cm, other than those of heading 60.01, containing by weight 5% or more of elastomeric yarn or rubber thread";"Fabrics; knitted or crocheted";2818,777;63;2014;60;155041390,38;8660156,341;22733684200,976;0,047726232791036;1,81808031590229e-05;0;167;16;-0,0670669125439501;-0,236398467992716;0,123120948409048;-3,55265424216155;0,0277365223509653;37,1145982826048;0,630498403740393;-0,863024759471941;-0,305720169539115;-0,599747777583816
2024;"ZAF";6005;"Fabrics; warp knit (including those made on galloon knitting machines), other than those of headings 60.01 to 60.04";"Fabrics; knitted or crocheted";2785,111;63;2014;60;155041390,38;3546493,243;22733684200,976;0,115150423685488;1,79636611434779e-05;0;167;21;-0,0670669125439501;0,584245830127547;0,132844189269562;-3,55265424216155;0,191812721590633;34,4796153120301;-0,141413946474088;-0,600869170993258;0,463187627565428;0,00124413434875255
2024;"ZAF";6006;"Fabrics; knitted or crocheted fabrics, other than those of headings 60.01 to 60.04";"Fabrics; knitted or crocheted";15781,345;63;2014;60;155041390,38;17002444,524;22733684200,976;0,136098962986925;0,000101787948117084;0;167;21;-0,0670669125439501;-0,689999863775176;0,138579757375498;-3,55265424216155;-0,138320866458929;39,9107981480224;1,44963888164385;-0,446228218080391;-1,08391238519521;-0,993259828306485
2024;"ZAF";6101;"Coats; men's or boys' overcoats, car-coats, capes, cloaks, anoraks, ski-jackets, wind-cheaters, wind-jackets and similar articles; knitted or crocheted, other than those of heading no. 6103";"Apparel and clothing accessories; knitted or crocheted";2267,531;63;2014;61;155041390,38;3374073,261;22733684200,976;0,0985418913043483;1,46253267881717e-05;0;167;38;-0,0670669125439501;-1,2741384314621;0,168688160111394;-3,55265424216155;-0,347414962906511;36,2974992530667;0,391131076022474;0,365547006930825;-2,0637868693197;-0,696456979470448
2024;"ZAF";6102;"Coats; women's or girls' overcoats, car-coats, capes, cloaks, anoraks, ski-jackets, wind-cheaters, wind-jackets and similar articles, knitted or crocheted, other than those of heading no. 6104";"Apparel and clothing accessories; knitted or crocheted";1000,421;63;2014;61;155041390,38;5164760,676;22733684200,976;0,0284023821096738;6,45260596249821e-06;0;167;39;-0,0670669125439501;-1,32015544309008;0,16340307634202;-3,55265424216155;-0,352281294056869;35,3629959712458;0,117370435969377;0,223051900042551;-2,08659188297885;-0,660303472968559
2024;"ZAF";6103;"Suits, ensembles, jackets, blazers, trousers, bib and brace overalls, breeches, shorts (not swimwear); men's or boys', knitted or crocheted";"Apparel and clothing accessories; knitted or crocheted";27317,241;63;2014;61;155041390,38;12400843,032;22733684200,976;0,323003919455988;0,000176193214812165;0;167;39;-0,0670669125439501;-1,47278291583974;0,172137310274569;-3,55265424216155;-0,387488059636522;36,933074790481;0,577321503931492;0,45854213106176;-2,25158081306422;-0,790120061977985
2024;"ZAF";6104;"Suits, ensembles, jackets, dresses, skirts, divided skirts, trousers, bib and brace overalls, breeches and shorts (not swimwear), women's or girls', knitted or crocheted";"Apparel and clothing accessories; knitted or crocheted";31920,486;63;2014;61;155041390,38;33402551,774;22733684200,976;0,140123835885178;0,000205883641276463;0;167;38;-0,0670669125439501;-1,47455180731185;0,169365573334025;-3,55265424216155;-0,387640469403805;36,9569323653209;0,584310526961517;0,383811252830898;-2,25229504863868;-0,817598107589767
2024;"ZAF";6105;"Shirts; men's or boys', knitted or crocheted";"Apparel and clothing accessories; knitted or crocheted";10408,356;63;2014;61;155041390,38;9260963,527;22733684200,976;0,1647965565226;6,71327570946671e-05;0;167;37;-0,0670669125439501;-1,8045540264722;0,179061547783434;-3,55265424216155;-0,443877003206704;39,2696849747723;1,26182621573919;0,645231691152192;-2,51583546171237;-1,04414332876645
2024;"ZAF";6106;"Blouses, shirts and shirt-blouses; women's or girls', knitted or crocheted";"Apparel and clothing accessories; knitted or crocheted";4663,451;63;2014;61;155041390,38;5670514,771;22733684200,976;0,120588835209067;3,0078748575268e-05;0;167;44;-0,0670669125439501;-1,64880300334084;0,175546133766088;-3,55265424216155;-0,410554562485888;40,6388564560756;1,66292192974642;0,550449977556461;-2,35967701455475;-1,1573829889149
2024;"ZAF";6107;"Underpants, briefs, nightshirts, pyjamas, bathrobes, dressing gowns and similar articles; men's or boys', knitted or crocheted";"Apparel and clothing accessories; knitted or crocheted";6196,3;63;2014;61;155041390,38;7956469,432;22733684200,976;0,114191612643249;3,99654568680862e-05;0;167;30;-0,0670669125439501;-1,39074125875546;0,159439316857488;-3,55265424216155;-0,342073734843549;36,2585113301514;0,379709651465419;0,11618200808345;-2,03875635348159;-0,767427998954519
2024;"ZAF";6108;"Slips, petticoats, briefs, panties, nightdresses, pyjamas, negligees, bathrobes, dressing gowns and similar articles; women's or girls', knitted or crocheted";"Apparel and clothing accessories; knitted or crocheted";10743,346;63;2014;61;155041390,38;12823289,238;22733684200,976;0,122846360122647;6,92934059328835e-05;0;167;29;-0,0670669125439501;-1,59758094145872;0,155465713611909;-3,55265424216155;-0,376161587450502;36,641450859648;0,491890927589279;0,00904671110074206;-2,19850173872025;-0,893781985069596
2024;"ZAF";6109;"T-shirts, singlets and other vests; knitted or crocheted";"Apparel and clothing accessories; knitted or crocheted";46872,742;63;2014;61;155041390,38;47649493,269;22733684200,976;0,144239511184005;0,00030232405608023;0;167;38;-0,0670669125439501;-1,59032916881961;0,175228215602033;-3,55265424216155;-0,398343501015734;39,7596411653976;1,40535778267196;0,541878347522656;-2,30245250290203;-1,05531064601711
2024;"ZAF";6110;"Jerseys, pullovers, cardigans, waistcoats and similar articles; knitted or crocheted";"Apparel and clothing accessories; knitted or crocheted";15781,573;63;2014;61;155041390,38;62240161,781;22733684200,976;0,037179345832842;0,000101789418692131;0;167;36;-0,0670669125439501;-1,45270787517684;0,164529616884697;-3,55265424216155;-0,384474837665781;38,2468531517335;0,962189927682318;0,253425404427278;-2,23745999677005;-0,982074840008363
2024;"ZAF";6111;"Garments and clothing accessories, babies'; knitted or crocheted";"Apparel and clothing accessories; knitted or crocheted";14978,705;63;2014;61;155041390,38;7183690,102;22733684200,976;0,305737596429701;9,66110079591509e-05;0;167;32;-0,0670669125439501;-1,56994678132398;0,166090313152955;-3,55265424216155;-0,373219418258862;35,7853787398464;0,241106520506372;0,295504506910813;-2,18471389598416;-0,710105303193239
2024;"ZAF";6112;"Track suits, ski suits and swimwear; knitted or crocheted";"Apparel and clothing accessories; knitted or crocheted";3198,547;63;2014;61;155041390,38;4994202,289;22733684200,976;0,0939093372841661;2,06302780964521e-05;0;167;30;-0,0670669125439501;-1,02565729640648;0,15770426966617;-3,55265424216155;-0,266951744444896;34,1496924779711;-0,238064100601054;0,0694020996143085;-1,68671331238723;-0,459749037390621
2024;"ZAF";6113;"Garments made up of knitted or crocheted fabrics of heading no. 5903, 5906 and 5907";"Apparel and clothing accessories; knitted or crocheted";180,387;63;2014;61;155041390,38;1256050,06;22733684200,976;0,0210581616779364;1,16347640818932e-06;0;167;27;-0,0670669125439501;-0,999934986928017;0,144924158665677;-3,55265424216155;-0,195187376239702;34,7369644023356;-0,0660241077762292;-0,275172057111869;-1,35040504511287;-0,519850998149503
2024;"ZAF";6114;"Garments; knitted or crocheted, n.e.c. in chapter 61";"Apparel and clothing accessories; knitted or crocheted";3166,985;63;2014;61;155041390,38;7463310,606;22733684200,976;0,0622209529760635;2,04267066506425e-05;0;167;36;-0,0670669125439501;-1,46901765522614;0,169490191544659;-3,55265424216155;-0,388908740898372;35,4940183357491;0,155753143730224;0,387171177861305;-2,25823853005486;-0,675606831974592
2024;"ZAF";6115;"Hosiery; panty hose, tights, stockings, socks and other hosiery, including graduated compression hosiery (for example, stockings for varicose veins) and footwear without applied soles, knitted or crocheted";"Apparel and clothing accessories; knitted or crocheted";26775,818;63;2014;61;155041390,38;14221668,543;22733684200,976;0,276066915728301;0,00017270109571627;0;167;29;-0,0670669125439501;-1,00707543827515;0,15343230946051;-3,55265424216155;-0,228359784861598;37,2421872648883;0,667875309882025;-0,0457774231125515;-1,50586039912711;-0,739837710707229
2024;"ZAF";6116;"Gloves, mittens and mitts; knitted or crocheted";"Apparel and clothing accessories; knitted or crocheted";3889,593;63;2014;61;155041390,38;5231299,842;22733684200,976;0,109022645232562;2,50874491673918e-05;0;167;19;-0,0670669125439501;-1,28557423294194;0,132337544469708;-3,55265424216155;-0,242298348597794;36,0549970835442;0,320090609462108;-0,614529201384439;-1,57118047837605;-0,835266763074199
2024;"ZAF";6117;"Clothing accessories; made up, knitted or crocheted, knitted or crocheted parts of garments or of clothing accessories";"Apparel and clothing accessories; knitted or crocheted";3502,77;63;2014;61;155041390,38;2885997,576;22733684200,976;0,177966323174103;2,25924831518529e-05;0;167;23;-0,0670669125439501;-1,3357011894158;0,145313701487123;-3,55265424216155;-0,215407218983737;34,9337329747738;-0,0083811958882478;-0,264669300977489;-1,4451609866459;-0,567149697245047
2024;"ZAF";6201;"Overcoats, car-coats, capes, cloaks, anoraks (including ski-jackets), wind-cheaters, wind-jackets and similar articles, men's or boys', other than those of heading no. 6203 (not knitted or crocheted)";"Apparel and clothing accessories; not knitted or crocheted";5784,536;63;2014;62;155041390,38;16331831,01;22733684200,976;0,0519344837794071;3,73096241321259e-05;0;167;30;-0,0670669125439501;-1,3846340495363;0,152205139959979;-3,55265424216155;-0,304171963589925;33,4607023730199;-0,439902206245964;-0,0788640602934997;-1,86113785929393;-0,500033237780488
2024;"ZAF";6202;"Coats; women's or girls' overcoats, carcoats, capes, cloaks, anoraks, ski-jackets, wind-cheaters, wind-jackets and similar articles, other than those of heading no. 6204 (not knitted or crocheted)";"Apparel and clothing accessories; not knitted or crocheted";2788,427;63;2014;62;155041390,38;20382895,044;22733684200,976;0,0200592910369581;1,79850489805702e-05;0;167;28;-0,0670669125439501;-1,24139585618619;0,149926776066299;-3,55265424216155;-0,251099754865396;32,7961402786288;-0,634584180996265;-0,140292737818278;-1,61242637470961;-0,372711643843874
2024;"ZAF";6203;"Suits, ensembles, jackets, blazers, trousers, bib and brace overalls, breeches and shorts (other than swimwear); men's or boys' (not knitted or crocheted)";"Apparel and clothing accessories; not knitted or crocheted";58301,954;63;2014;62;155041390,38;44862328,477;22733684200,976;0,19055636861735;0,00037604122265096;0;167;41;-0,0670669125439501;-1,45949794961102;0,166405899117274;-3,55265424216155;-0,376029746544255;36,4765595654709;0,44358639285811;0,304013256758575;-2,19788389468644;-0,779152343595325
2024;"ZAF";6204;"Suits, ensembles, jackets, dresses, skirts, divided skirts, trousers, bib and brace overalls, breeches and shorts (other than swimwear); women's or girls' (not knitted or crocheted)";"Apparel and clothing accessories; not knitted or crocheted";41898,66;63;2014;62;155041390,38;67610341,821;22733684200,976;0,0908676236043135;0,000270241771550862;0;167;36;-0,0670669125439501;-1,30108442870538;0,163516252687166;-3,55265424216155;-0,34365656187974;36,5284089835138;0,45877556356083;0,226103332357069;-2,04617393174848;-0,759615387650749
2024;"ZAF";6205;"Shirts; men's or boys' (not knitted or crocheted)";"Apparel and clothing accessories; not knitted or crocheted";16525,96;63;2014;62;155041390,38;12597682,633;22733684200,976;0,19235266267065;0,000106590633375356;0;167;38;-0,0670669125439501;-1,4057265564788;0,161203054041916;-3,55265424216155;-0,372119861619293;37,1009371862822;0,626496416218413;0,163735448971987;-2,17956106042702;-0,880774009224481
2024;"ZAF";6206;"Blouses, shirts and shirt-blouses; women's or girls' (not knitted or crocheted)";"Apparel and clothing accessories; not knitted or crocheted";9663,924;63;2014;62;155041390,38;12605404,265;22733684200,976;0,112413610290633;6,23312521663675e-05;0;167;36;-0,0670669125439501;-1,25476130799577;0,155077533153775;-3,55265424216155;-0,317074931945058;37,6260603458525;0,780330067814115;-0,00141931333472189;-1,92160484365869;-0,901118074935843
2024;"ZAF";6207;"Singlets and other vests, underpants, briefs, night-shirts, pyjamas, bathrobes, dressing gowns and similar articles; men's or boys' (not knitted or crocheted)";"Apparel and clothing accessories; not knitted or crocheted";4844,062;63;2014;62;155041390,38;1403374,977;22733684200,976;0,506125399996627;3,12436697589425e-05;0;167;36;-0,0670669125439501;-1,23633679126516;0,168599838448568;-3,55265424216155;-0,353039474548621;38,4689138194172;1,02724210213512;0,363165700345322;-2,09014493268638;-0,918073778158725
2024;"ZAF";6208;"Singlets and other vests, slips, petticoats, briefs, panties, nightdresses, pyjamas, negligees, bathrobes, dressing gowns and similar articles; women's or girls' (not knitted or crocheted)";"Apparel and clothing accessories; not knitted or crocheted";2100,94;63;2014;62;155041390,38;2927192,225;22733684200,976;0,105240905276196;1,35508330701285e-05;0;167;29;-0,0670669125439501;-1,47938773620942;0,158205106934052;-3,55265424216155;-0,358175429691062;35,6012213073118;0,187158013762795;0,0829055487808162;-2,11421348115899;-0,739488648713657
2024;"ZAF";6209;"Garments and clothing accessories; babies' (not knitted or crocheted)";"Apparel and clothing accessories; not knitted or crocheted";3115,166;63;2014;62;155041390,38;1954247,495;22733684200,976;0,233735026456473;2,00924797717878e-05;0;167;33;-0,0670669125439501;-1,51605887602681;0,171096187807425;-3,55265424216155;-0,376631294853428;36,88451875009;0,563097120823935;0,430471647468075;-2,20070292137893;-0,777776131578262
2024;"ZAF";6210;"Garments made up of fabrics of heading no. 5602, 5603, 5903, 5906 or 5907 (not knitted or crocheted)";"Apparel and clothing accessories; not knitted or crocheted";4451,85;63;2014;62;155041390,38;11457813,073;22733684200,976;0,0569719334809396;2,87139452831834e-05;0;167;32;-0,0670669125439501;-1,40357358013576;0,163875942492099;-3,55265424216155;-0,325713570219369;34,9523905033675;-0,00291551474087498;0,235801198925912;-1,96208796282079;-0,574457083051334
