"year";"country_iso3";"prod_code";"prod_descr";"sector";"X_cp";"gini";"gini_year";"hs2";"tot_exp_c";"tot_exp_p";"tot_world_exp";"RCA_cp";"s_cp";"M_cp";"diversity_c";"ubiquity_p";"eci_c";"pci_p";"dens_cp";"coi_c";"cog_cp";"PGI_p";"PGI_Z";"DENS_Z";"COG_Z";"EBS"
2024;"ZAF";8409;"Parts suitable for use solely or principally with the engines of heading no. 8407 or 8408";"Nuclear reactors, boilers, machinery and mechanical appliances; parts thereof";225229,224;63;2014;84;155041390,38;71719606,179;22733684200,976;0,460478134476467;0,00145270384539233;0;167;24;-0,0670669125439501;0,80854726921994;0,136879914472636;-3,55265424216155;0,28354132024721;34,2215601587032;-0,217010624750198;-0,492058957328121;0,893053964373305;0,206001877265127
2024;"ZAF";8410;"Turbines; hydraulic water wheels and regulators therefor";"Nuclear reactors, boilers, machinery and mechanical appliances; parts thereof";708,905;63;2014;84;155041390,38;1106095,612;22733684200,976;0,0939761260980313;4,57235966642523e-06;0;167;20;-0,0670669125439501;-0,0874847338699806;0,133878718724759;-3,55265424216155;0,139635970494661;31,2531097823051;-1,08661150343854;-0,572976446538897;0,218672512447034;0,244102523115559
2024;"ZAF";8411;"Turbo-jets, turbo-propellers and other gas turbines";"Nuclear reactors, boilers, machinery and mechanical appliances; parts thereof";63609,048;63;2014;84;155041390,38;210277350,177;22733684200,976;0,0443556112631412;0,00041027139813502;0;167;14;-0,0670669125439501;0,896609610334264;0,134134830304438;-3,55265424216155;0,27737002803611;32,3932672782608;-0,752604922695491;-0,566071230176356;0,864133531542008;0,350222408020381
2024;"ZAF";8412;"Engines and motors; n.e.c. (e.g. reaction engines, hydraulic power engines, pneumatic power engines)";"Nuclear reactors, boilers, machinery and mechanical appliances; parts thereof";62074,144;63;2014;84;155041390,38;28855029,461;22733684200,976;0,315436093589595;0,000400371435317104;0;167;21;-0,0670669125439501;0,906066885637803;0,139651079140931;-3,55265424216155;0,364507615417534;34,0127746520152;-0,27817387056924;-0,417343508558522;1,27248508203463;0,377771814681784
2024;"ZAF";8413;"Pumps; for liquids, whether or not fitted with measuring device, liquid elevators";"Nuclear reactors, boilers, machinery and mechanical appliances; parts thereof";401437,238;63;2014;84;155041390,38;77553321,01;22733684200,976;0,75899589023251;0,00258922625123584;0;167;19;-0,0670669125439501;1,29854933097888;0,124547269480224;-3,55265424216155;0,465848209546142;32,1154943462744;-0,833977879997286;-0,824568647447383;1,74739596703675;0,58560173319555
2024;"ZAF";8414;"Air or vacuum pumps, air or other gas compressors and fans; ventilating or recycling hoods incorporating a fan whether or not fitted with filters";"Nuclear reactors, boilers, machinery and mechanical appliances; parts thereof";92264,149;63;2014;84;155041390,38;93740516,876;22733684200,976;0,144320426935407;0,000595093663529877;0;167;21;-0,0670669125439501;1,22222042610172;0,130151450666701;-3,55265424216155;0,399151985239578;32,337064368874;-0,769069438921257;-0,673470115799533;1,43483846543445;0,510145929518726
2024;"ZAF";8415;"Air conditioning machines; comprising a motor driven fan and elements for changing the temperature and humidity, including those machines in which the humidity cannot be separately regulated";"Nuclear reactors, boilers, machinery and mechanical appliances; parts thereof";54780,509;63;2014;84;155041390,38;68193924,6;22733684200,976;0,117788406534326;0,000353328287792926;0;167;13;-0,0670669125439501;0,463440766531354;0,121598166123485;-3,55265424216155;0,164913388481958;35,398776472185;0,127852253453686;-0,904081634635638;0,337129691923217;-0,231601398722036
2024;"ZAF";8416;"Furnace burners for liquid fuel, for pulverised solid fuel or for gas; mechanical grates, mechanical ash dischargers and similar appliances";"Nuclear reactors, boilers, machinery and mechanical appliances; parts thereof";6588,041;63;2014;84;155041390,38;2443202,984;22733684200,976;0,395383836887994;4,24921434453921e-05;0;167;20;-0,0670669125439501;0,805447735068926;0,144760543528194;-3,55265424216155;0,295968717309815;32,8440039045003;-0,620562639168909;-0,279583407531569;0,951292286222736;0,430757172620025
2024;"ZAF";8417;"Furnaces and ovens; industrial or laboratory, including incinerators, non-electric";"Nuclear reactors, boilers, machinery and mechanical appliances; parts thereof";15688,865;63;2014;84;155041390,38;6003612,265;22733684200,976;0,383178434052127;0,000101191462238227;0;167;16;-0,0670669125439501;0,934849788302468;0,130761675507298;-3,55265424216155;0,33377871188429;33,3623830573217;-0,468704629221583;-0,65701738625329;1,12848068875471;0,313389310574334
2024;"ZAF";8418;"Refrigerators, freezers and other refrigerating or freezing equipment, electric or other; heat pumps other than air conditioning machines of heading no. 8415";"Nuclear reactors, boilers, machinery and mechanical appliances; parts thereof";147111,076;63;2014;84;155041390,38;61503119,491;22733684200,976;0,350727965761224;0,000948850340153922;0;167;25;-0,0670669125439501;0,485886387401227;0,142013757783878;-3,55265424216155;0,143902235504773;37,9532032198173;0,876165838867694;-0,353641557849564;0,238665445279405;-0,330380650479285
2024;"ZAF";8419;"Machinery, plant (not domestic), or laboratory equipment; electrically heated or not, (excluding items in 85.14) for the treatment of materials by a process involving change of temperature; including instantaneous or non electric storage water heaters";"Nuclear reactors, boilers, machinery and mechanical appliances; parts thereof";86229,576;63;2014;84;155041390,38;53216146,882;22733684200,976;0,237593739414754;0,000556171328112157;0;167;31;-0,0670669125439501;0,900471092278374;0,150402553955101;-3,55265424216155;0,249920407907321;32,4029030660872;-0,749782140267545;-0,127464933363639;0,735496794206609;0,452604667036838
2024;"ZAF";8420;"Machines; calendering or other rolling machines, for other than metal or glass and cylinders therefor";"Nuclear reactors, boilers, machinery and mechanical appliances; parts thereof";2232,543;63;2014;84;155041390,38;1677283,531;22733684200,976;0,195171103702645;1,43996580173083e-05;0;167;14;-0,0670669125439501;1,85833435673656;0,112551999538457;-3,55265424216155;0,539230585031118;31,3771936956506;-1,05026139937945;-1,14798211582241;2,09128667721849;0,66452198692518
2024;"ZAF";8421;"Centrifuges, including centrifugal dryers; filtering or purifying machinery and apparatus for liquids or gases";"Nuclear reactors, boilers, machinery and mechanical appliances; parts thereof";1449209,725;63;2014;84;155041390,38;91999747,592;22733684200,976;2,30975955473905;0,00934724412266974;1;167;27;-0,0670669125439501;0,907483712805165;0,158722108661612;-3,55265424216155;0;34,4164907255888;-0,1599061524657;0,0968448200667301;-0,435701412394878;-0,0596501466208158
2024;"ZAF";8422;"Dish washing machines; machinery for cleaning, drying, filling, closing, sealing, capsuling or labelling bottles, cans, boxes, bags, etc, machinery for aerating beverages";"Nuclear reactors, boilers, machinery and mechanical appliances; parts thereof";49082,805;63;2014;84;155041390,38;35982236,61;22733684200,976;0,200015378029877;0,000316578720557782;0;167;18;-0,0670669125439501;0,980207346377266;0,130143194259741;-3,55265424216155;0,339700891922256;32,5533141038657;-0,705719564165029;-0,673692722979214;1,15623371099773;0,396086850727848
2024;"ZAF";8423;"Weighing machines; excluding balances of a sensitivity of 5cg or better, including weight operated counting or checking machines and weights of all kinds";"Nuclear reactors, boilers, machinery and mechanical appliances; parts thereof";14507,732;63;2014;84;155041390,38;4692885,333;22733684200,976;0,453295857296863;9,35732836531081e-05;0;167;13;-0,0670669125439501;0,540291486347757;0,125997680890234;-3,55265424216155;0,30489185051653;31,4755508079133;-1,02144790398502;-0,78546301773173;0,993108629659748;0,409697838637679
2024;"ZAF";8424;"Mechanical appliances for projecting, dispersing or spraying liquids or powders; fire extinguishers, spray guns, steam, sand blasting machines";"Nuclear reactors, boilers, machinery and mechanical appliances; parts thereof";127987,111;63;2014;84;155041390,38;25299331,219;22733684200,976;0,741787248754834;0,000825502858857941;0;167;19;-0,0670669125439501;1,09563310289464;0,129520038844826;-3,55265424216155;0,393094237046187;32,8343447309378;-0,623392272395776;-0,690494083436522;1,40645013220648;0,44644944038858
2024;"ZAF";8425;"Pulley tackle and hoists other than skip hoists; winches and capstans; jacks";"Nuclear reactors, boilers, machinery and mechanical appliances; parts thereof";27026,064;63;2014;84;155041390,38;8242959,588;22733684200,976;0,480752773754015;0,000174315155028991;0;167;16;-0,0670669125439501;0,555898956017728;0,12865167548974;-3,55265424216155;0,268205788250241;32,4903129545141;-0,724175609538086;-0,713906679054755;0,821187294010033;0,277152074831121
2024;"ZAF";8426;"Derricks, cranes, including cable cranes, mobile lifting frames, straddle carriers and works trucks fitted with a crane";"Nuclear reactors, boilers, machinery and mechanical appliances; parts thereof";31959,587;63;2014;84;155041390,38;17591926,323;22733684200,976;0,266385100057806;0,000206135838447194;0;167;19;-0,0670669125439501;0,816490141141082;0,127131507783855;-3,55265424216155;0,374594683776541;30,9665584865082;-1,17055606272627;-0,754893060575031;1,31975595707384;0,578472986408361
2024;"ZAF";8427;"Fork-lift and other works trucks; fitted with lifting or handling equipment";"Nuclear reactors, boilers, machinery and mechanical appliances; parts thereof";27769;63;2014;84;155041390,38;32224871,42;22733684200,976;0,126354646117595;0,000179107010921015;0;167;12;-0,0670669125439501;1,77370896735115;0,111347327788115;-3,55265424216155;0,529086926411712;32,2633996009066;-0,79064936744631;-1,18046217428903;2,04375060410264;0,551312599086641
2024;"ZAF";8428;"Lifting, handling, loading or unloading machinery; n.e.c. in heading no. 8425, 8426 or 8427 (e.g. lifts, escalators, conveyors, teleferics)";"Nuclear reactors, boilers, machinery and mechanical appliances; parts thereof";48458,225;63;2014;84;155041390,38;37837259,678;22733684200,976;0,187788933275092;0,000312550247912708;0;167;25;-0,0670669125439501;1,00088396579708;0,144083749440479;-3,55265424216155;0,324337449545524;31,2303178503502;-1,09328834877594;-0,297830960470872;1,08423624464626;0,626564544317108
2024;"ZAF";8429;"Bulldozers, graders, levellers, scrapers, angledozers, mechanical shovels, excavators, shovel loaders, tamping machines and road rollers, self-propelled";"Nuclear reactors, boilers, machinery and mechanical appliances; parts thereof";231855,561;63;2014;84;155041390,38;60063946,142;22733684200,976;0,566012241058821;0,00149544299384656;0;167;21;-0,0670669125439501;0,342817217222019;0,143556981741821;-3,55265424216155;0,243256529187872;34,4280697737089;-0,156514096293997;-0,312033539427242;0,704267960712856;0,182916172526537
2024;"ZAF";8430;"Moving, grading, levelling, scraping, excavating, tamping, compacting, extracting or boring machinery, for earth, minerals, or ores; pile drivers and extractors; snow ploughs and snow blowers";"Nuclear reactors, boilers, machinery and mechanical appliances; parts thereof";105283,824;63;2014;84;155041390,38;13449361,418;22733684200,976;1,14784211338218;0,000679069142388066;1;167;22;-0,0670669125439501;-0,503078668189758;0,179502432599696;-3,55265424216155;0;33,627126587634;-0,391148605911548;0,65711871731112;-0,435701412394878;0,204188636942597
2024;"ZAF";8431;"Machinery parts; used solely or principally with the machinery of heading no. 8425 to 8430";"Nuclear reactors, boilers, machinery and mechanical appliances; parts thereof";378653,34;63;2014;84;155041390,38;68822102,213;22733684200,976;0,806744523862913;0,00244227260263815;0;167;28;-0,0670669125439501;0,924493215992299;0,143162616758375;-3,55265424216155;0,284034128523292;31,9744726622685;-0,875289865975125;-0,322666309487533;0,895363404302515;0,482662320263369
2024;"ZAF";8432;"Agricultural, horticultural or forestry machinery for soil preparation or cultivation; lawn or sports-ground rollers";"Nuclear reactors, boilers, machinery and mechanical appliances; parts thereof";44983,107;63;2014;84;155041390,38;9350036,777;22733684200,976;0,705437103569475;0,000290136117134581;0;167;24;-0,0670669125439501;0,82458039775222;0,140971663609233;-3,55265424216155;0,245343027529394;31,9898411044832;-0,870787715304114;-0,381738240377886;0,714045886157719;0,401031787027982
2024;"ZAF";8433;"Harvesting and threshing machinery, straw and fodder balers, grass or hay mowers; machines for cleaning, sorting or grading eggs, fruit or other agricultural produce, other than machinery of heading no 8437";"Nuclear reactors, boilers, machinery and mechanical appliances; parts thereof";28344,565;63;2014;84;155041390,38;26236885,197;22733684200,976;0,158408940686058;0,00018281934218036;0;167;25;-0,0670669125439501;0,911601241870022;0,144594469003877;-3,55265424216155;0,306540025513018;31,4104713950026;-1,04051277200562;-0,284061067324041;1,00083244707912;0,585761383920234
2024;"ZAF";8434;"Milking machines and dairy machinery";"Nuclear reactors, boilers, machinery and mechanical appliances; parts thereof";6650,363;63;2014;84;155041390,38;2378261,057;22733684200,976;0,410022788744357;4,28941135247835e-05;0;167;23;-0,0670669125439501;0,633394762280576;0,151315640256716;-3,55265424216155;0,259359251074657;31,830416504081;-0,917490794357284;-0,102846528845471;0,779729901388781;0,531458055633531
2024;"ZAF";8436;"Agricultural, horticultural, forestry, poultry-keeping, bee-keeping machinery; including germination plant fitted with mechanical or thermal equipment; poultry incubators and brooders";"Nuclear reactors, boilers, machinery and mechanical appliances; parts thereof";54211,862;63;2014;84;155041390,38;9059879,5;22733684200,976;0,877392809941969;0,000349660576876465;0;167;20;-0,0670669125439501;0,604165246872016;0,146104424033693;-3,55265424216155;0,243443851435324;30,8372705940373;-1,20843066079615;-0,243350037421935;0,705145806112155;0,556742143162123
2024;"ZAF";8437;"Machines for cleaning, sorting, grading seed, grain, dried leguminous vegetables; machinery used in the milling industry for the working of cereals or dried leguminous vegetables, not farm type machinery";"Nuclear reactors, boilers, machinery and mechanical appliances; parts thereof";27480,248;63;2014;84;155041390,38;2509251,875;22733684200,976;1,60582627188133;0,000177244592122446;1;167;23;-0,0670669125439501;0,142215275420806;0,17089340117103;-3,55265424216155;0;37,9229514539804;0,867303651929076;0,425004164890775;-0,435701412394878;-0,292666966477726
2024;"ZAF";8438;"Machinery n.e.c. in this chapter, for the industrial preparation or manufacture of food or drink; other than machinery for extraction or preparation of animal or fixed vegetable fats or oils";"Nuclear reactors, boilers, machinery and mechanical appliances; parts thereof";62696,706;63;2014;84;155041390,38;16309157,503;22733684200,976;0,563683556182391;0,00040438689208303;0;167;25;-0,0670669125439501;0,307837821236079;0,154816055721441;-3,55265424216155;0,118656215350392;31,5663830142204;-0,994838812909811;-0,00846920247464742;0,120355404990094;0,368908338475086
2024;"ZAF";8439;"Machinery; for making pulp of fibrous cellulosic material, or for making or finishing paper or paperboard";"Nuclear reactors, boilers, machinery and mechanical appliances; parts thereof";1138,643;63;2014;84;155041390,38;5510442,025;22733684200,976;0,0302986523113241;7,34412273528529e-06;0;167;13;-0,0670669125439501;1,51690202701298;0,12078675467438;-3,55265424216155;0,438702406474114;29,1208557935109;-1,71125052620438;-0,925958707207428;1,62018300295377;0,801824940650241
2024;"ZAF";8440;"Book-binding machinery; including book-sewing machines";"Nuclear reactors, boilers, machinery and mechanical appliances; parts thereof";511,679;63;2014;84;155041390,38;945002,448;22733684200,976;0,079393843737427;3,3002735511201e-06;0;167;15;-0,0670669125439501;0,990857675608711;0,130720385380638;-3,55265424216155;0,349336651080595;33,5749732151064;-0,406426819398671;-0,658130640322401;1,20138962259369;0,316561933889988
2024;"ZAF";8441;"Machines; for making up paper pulp, paper or paperboard, including cutting machines of all kinds";"Nuclear reactors, boilers, machinery and mechanical appliances; parts thereof";11066,526;63;2014;84;155041390,38;8103917,462;22733684200,976;0,200234297302573;7,13778815636031e-05;0;167;17;-0,0670669125439501;0,996251360799992;0,133614083782972;-3,55265424216155;0,365820702745461;31,9589629844566;-0,879833391297526;-0,58011146765906;1,27863858320909;0,526120168949187
2024;"ZAF";8442;"Machinery, apparatus and equipment (excluding machine-tools of heading no. 8456 to 8465) for preparing or making printing components; plates, cylinders and other printing components; lithographic stones prepared for printing purposes";"Nuclear reactors, boilers, machinery and mechanical appliances; parts thereof";4147,191;63;2014;84;155041390,38;1298387,939;22733684200,976;0,468351303425823;2,67489280754991e-05;0;167;23;-0,0670669125439501;1,00654081218978;0,138378427276441;-3,55265424216155;0,337625280631232;33,4054965395217;-0,4560746313269;-0,451656429862236;1,14650680537204;0,383641668945567
2024;"ZAF";8443;"Printing machinery; used for printing by means of plates, cylinders and other printing components of heading 84.42; other printers, copying machines and facsimile machines, whether or not combined; parts and accessories thereof";"Nuclear reactors, boilers, machinery and mechanical appliances; parts thereof";89903,833;63;2014;84;155041390,38;81651325,476;22733684200,976;0,161449660928589;0,000579869883646228;0;167;14;-0,0670669125439501;1,02942745131079;0,110736871196517;-3,55265424216155;0,32104555161213;36,1476571281744;0,347235161673722;-1,1969211522478;1,06880947342661;-0,158448946831638
2024;"ZAF";8444;"Textile machinery; for extruding, drawing, texturing or cutting man-made textile materials";"Nuclear reactors, boilers, machinery and mechanical appliances; parts thereof";38,934;63;2014;84;155041390,38;914476,919;22733684200,976;0,00624278595196878;2,51120039007483e-07;0;167;6;-0,0670669125439501;1,12470223404617;0,0976022717214297;-3,55265424216155;0,322354977587268;33,0923686044197;-0,547804757480094;-1,55105293857499;1,07494581645918;0,0238992117880952
2024;"ZAF";8445;"Textile machinery; spinning, doubling, twisting machines, textile reeling or winding machines and machines for preparing textile yarns for use on machines of heading no. 8446 and 8447";"Nuclear reactors, boilers, machinery and mechanical appliances; parts thereof";212,098;63;2014;84;155041390,38;2940312,814;22733684200,976;0,0105770657764183;1,36800888769223e-06;0;167;12;-0,0670669125439501;0,667147337717845;0,113977015692861;-3,55265424216155;0,373953631060908;34,0635185370763;-0,263308563273531;-1,10956118663752;1,31675180148218;0,15683305937273
2024;"ZAF";8446;"Weaving machines (looms)";"Nuclear reactors, boilers, machinery and mechanical appliances; parts thereof";506,917;63;2014;84;155041390,38;1743343,598;22733684200,976;0,042635958731425;3,26955917228017e-06;0;167;9;-0,0670669125439501;1,62057752341737;0,105993764934094;-3,55265424216155;0,447097879508467;31,3846175063691;-1,04808661068318;-1,3248035971322;1,65952658055009;0,460936531367022
2024;"ZAF";8447;"Knitting machines, stitch-bonding machines and machines for making gimped yarn, tulle, lace, embroidery, trimmings, braid or net and machines for tufting";"Nuclear reactors, boilers, machinery and mechanical appliances; parts thereof";1115,778;63;2014;84;155041390,38;2379009,432;22733684200,976;0,0687707560084038;7,19664598766352e-06;0;167;8;-0,0670669125439501;0,961474115271573;0,097892499831125;-3,55265424216155;0,33823050216249;34,616302785263;-0,101371657819366;-1,54322788086206;1,14934304582931;-0,0975043924044608
2024;"ZAF";8448;"Machinery, auxiliary; for use with machines of heading no. 8444 to 8447 (e.g. dobbies, jaquards, automatic stop motions, shuttle changing mechanisms) parts, accessories for machines of heading no. 8444, 8447";"Nuclear reactors, boilers, machinery and mechanical appliances; parts thereof";4117,004;63;2014;84;155041390,38;4431644,388;22733684200,976;0,136219271608756;2,65542252292075e-05;0;167;14;-0,0670669125439501;1,07182596383309;0,12152441542866;-3,55265424216155;0,392245446123647;32,6107058079063;-0,68890679321223;-0,906070082425827;1,40247245621523;0,39510305566721
2024;"ZAF";8449;"Machinery; for manufacture or finishing felt or non-wovens in the piece or in shapes, including machinery for making felt hats, blocks for making hats";"Nuclear reactors, boilers, machinery and mechanical appliances; parts thereof";24,295;63;2014;84;155041390,38;708063,638;22733684200,976;0,00503114436982053;1,56700091120532e-07;0;167;7;-0,0670669125439501;1,58246424738191;0,10174810103273;-3,55265424216155;0,366655527202375;33,7147902952014;-0,365467719434284;-1,43927412547886;1,2825508083649;0,0695814674401102
2024;"ZAF";8450;"Household or laundry-type washing machines; including machines which both wash and dry";"Nuclear reactors, boilers, machinery and mechanical appliances; parts thereof";12976,975;63;2014;84;155041390,38;18416221,151;22733684200,976;0,103322549723409;8,37000685313385e-05;0;167;17;-0,0670669125439501;0,409935853528501;0,129119810073643;-3,55265424216155;0,143937346394782;33,5140406611388;-0,424276874394454;-0,701284951475353;0,238829984909262;-0,0127260307238791
2024;"ZAF";8451;"Machinery (not of heading no. 8450) for washing, cleaning, wringing, drying, ironing, pressing, bleaching, dyeing, dressing, finishing, coating or impregnating textile yarn, fabrics or made up articles";"Nuclear reactors, boilers, machinery and mechanical appliances; parts thereof";5268,75;63;2014;84;155041390,38;10053119,097;22733684200,976;0,0768473565316773;3,39828608804817e-05;0;167;14;-0,0670669125439501;1,11535204482741;0,111324421153419;-3,55265424216155;0,373555048839636;34,348866039392;-0,179716652585683;-1,18107977724518;1,31488393168056;0,10450693567369
2024;"ZAF";8452;"Sewing machines; other than book-sewing machines of heading no. 8440; furniture, bases and covers specially designed for sewing machines; sewing machine needles";"Nuclear reactors, boilers, machinery and mechanical appliances; parts thereof";3792,378;63;2014;84;155041390,38;4853877,302;22733684200,976;0,114563162312545;2,44604230567401e-05;0;167;13;-0,0670669125439501;0,368318680172134;0,101543052091218;-3,55265424216155;0,220608408830537;34,6108697994798;-0,102963238816812;-1,44480260376096;0,598132418731659;-0,247902315404162
2024;"ZAF";8453;"Machinery for preparing, tanning or working hides, skins or leather or for making or repairing footwear or other articles of hides, skins or leather, other than sewing machines";"Nuclear reactors, boilers, machinery and mechanical appliances; parts thereof";4210,944;63;2014;84;155041390,38;999315,848;22733684200,976;0,617872490334303;2,71601279482798e-05;0;167;10;-0,0670669125439501;0,507654678878095;0,113755302998832;-3,55265424216155;0,179177255175849;33,8259129840218;-0,332914577024102;-1,11553894884769;0,403974233475353;-0,126216712782745
2024;"ZAF";8454;"Converters, ladles, ingot moulds and casting machines; of a kind used metallurgy or in metal foundries";"Nuclear reactors, boilers, machinery and mechanical appliances; parts thereof";18056,65;63;2014;84;155041390,38;3355385,38;22733684200,976;0,789072559042095;0,000116463416354458;0;167;15;-0,0670669125439501;1,08190620481007;0,124629508578284;-3,55265424216155;0,361071992400143;31,783326789703;-0,931285620548688;-0,822351337451964;1,25638477413973;0,455106352412152
2024;"ZAF";8455;"Metal-rolling mills and rolls therefor";"Nuclear reactors, boilers, machinery and mechanical appliances; parts thereof";17513,879;63;2014;84;155041390,38;6894104,329;22733684200,976;0,372500330160576;0,000112962602806091;0;167;17;-0,0670669125439501;0,887113435757553;0,130391941959401;-3,55265424216155;0,343189793693543;31,8664752486797;-0,906927466017087;-0,666986049708175;1,17258369830671;0,470841704871874
2024;"ZAF";8456;"Machine-tools; for working any material by removal of material, by laser, other light or photon beam, ultrasonic, electro-discharge, electro-chemical, electron beam, ionic beam or plasma arc processes";"Nuclear reactors, boilers, machinery and mechanical appliances; parts thereof";2228,837;63;2014;84;155041390,38;6672945,494;22733684200,976;0,0489759534698604;1,43757547228983e-05;0;167;14;-0,0670669125439501;1,79880888779679;0,11224687282748;-3,55265424216155;0,513762094758874;33,3567481057999;-0,470355375629118;-1,15620886589723;1,97193407859933;0,428693529443741
2024;"ZAF";8457;"Machining centres, unit construction machines (single station) and multi-station transfer machines for working metal";"Nuclear reactors, boilers, machinery and mechanical appliances; parts thereof";1174,781;63;2014;84;155041390,38;9238231,247;22733684200,976;0,0186461963555313;7,577208880291e-06;0;167;10;-0,0670669125439501;2,0347837467693;0,113107707388618;-3,55265424216155;0,508714596358593;33,3799411881799;-0,46356101417457;-1,13299925973861;1,94828006361219;0,42628060601605
2024;"ZAF";8458;"Lathes for removing metal";"Nuclear reactors, boilers, machinery and mechanical appliances; parts thereof";995,947;63;2014;84;155041390,38;6652829,545;22733684200,976;0,0219508832479818;6,42374915213915e-06;0;167;10;-0,0670669125439501;1,84645886347587;0,111037595852046;-3,55265424216155;0,50626117436093;33,1732325782307;-0,524115837753044;-1,1888130892911;1,936782629418;0,424028459293315
