"year";"country_iso3";"prod_code";"prod_descr";"sector";"X_cp";"gini";"gini_year";"hs2";"tot_exp_c";"tot_exp_p";"tot_world_exp";"RCA_cp";"s_cp";"M_cp";"diversity_c";"ubiquity_p";"eci_c";"pci_p";"dens_cp";"coi_c";"cog_cp";"PGI_p";"PGI_Z";"DENS_Z";"COG_Z";"EBS"
2024;"ZAF";2847;"Hydrogen peroxide; whether or not solidified with urea";"Inorganic chemicals; organic and inorganic compounds of precious metals; of rare earth metals, of radio-active elements and of isotopes";2641,42;63;2014;28;155041390,38;987949,225;22733684200,976;0,392035147875936;1,7036869919226e-05;0;167;21;-0,0670669125439501;0,344882991402948;0,149622106786932;-3,55265424216155;0,182163785270729;33,3561460495665;-0,4705317466521;-0,148507154736426;0,417969964037629;0,246664851984434
2024;"ZAF";2848;"Phosphides; whether or not chemically defined, excluding ferrophosphorus";"Inorganic chemicals; organic and inorganic compounds of precious metals; of rare earth metals, of radio-active elements and of isotopes";514,656;63;2014;28;155041390,38;956327,554;22733684200,976;0,0789100901807115;3,31947487531297e-06;0;167;14;-0,0670669125439501;1,08426944813853;0,128026164288544;-3,55265424216155;0,40099392026548;35,5493006928515;0,17194798622935;-0,730771555632633;1,44347029753283;0,180250251890281
2024;"ZAF";2849;"Carbides, whether or not chemically defined";"Inorganic chemicals; organic and inorganic compounds of precious metals; of rare earth metals, of radio-active elements and of isotopes";66274,539;63;2014;28;155041390,38;2130472,933;22733684200,976;4,5613443837765;0,000427463523369881;1;167;16;-0,0670669125439501;0,0817827161258887;0,180369634838248;-3,55265424216155;0;34,32641722857;-0,186292981356922;0,680500007195737;-0,435701412394878;0,143697192052594
2024;"ZAF";2850;"Hydrides, nitrides, azides, silicides and borides, whether or not chemically defined, other than compounds which are also carbides of heading no. 2849";"Inorganic chemicals; organic and inorganic compounds of precious metals; of rare earth metals, of radio-active elements and of isotopes";9566,271;63;2014;28;155041390,38;721438,053;22733684200,976;1,94431130897775;6,17014010036511e-05;1;167;10;-0,0670669125439501;1,45960820149297;0,1543176098639;-3,55265424216155;0;34,5914727458907;-0,108645562152632;-0,0219081750335884;-0,435701412394878;-0,116321341758611
2024;"ZAF";2901;"Acyclic hydrocarbons";"Organic chemicals";533906,551;63;2014;29;155041390,38;26134297,309;22733684200,976;2,99555012198309;0,0034436388224552;1;167;21;-0,0670669125439501;0,0784772938734654;0,202015174576494;-3,55265424216155;0;35,8791530128163;0,268577483410582;1,26410163646964;-0,435701412394878;0,186607580221395
2024;"ZAF";2902;"Cyclic hydrocarbons";"Organic chemicals";6632,818;63;2014;29;155041390,38;41774236,319;22733684200,976;0,0232815413816901;4,27809501949334e-05;0;167;16;-0,0670669125439501;0,551774417419077;0,146723975852858;-3,55265424216155;0,219986785405023;32,5363657410754;-0,710684549024443;-0,226645836212046;0,595219314326782;0,35975267571306
2024;"ZAF";2903;"Halogenated derivatives of hydrocarbons";"Organic chemicals";5134,665;63;2014;29;155041390,38;10916134,892;22733684200,976;0,0689708199430066;3,31180273049355e-05;0;167;14;-0,0670669125439501;0,370227631562581;0,137715080329321;-3,55265424216155;0,231761620225489;33,0230240973048;-0,568119075280002;-0,469541424359697;0,650399543665527;0,249659064861944
2024;"ZAF";2904;"Sulphonated, nitrated or nitrosated derivatives of hydrocarbons; whether or not halogenated";"Organic chemicals";1489,981;63;2014;29;155041390,38;2192372,99;22733684200,976;0,0996525590828243;9,61021438435323e-06;0;167;11;-0,0670669125439501;-0,615856856912553;0,152891690890773;-3,55265424216155;0,0125675118233655;36,0834117305167;0,328414616550575;-0,0603534457911067;-0,376806472873064;-0,255191511738249
2024;"ZAF";2905;"Acyclic alcohols and their halogenated, sulphonated, nitrated or nitrosated derivatives";"Organic chemicals";361812,344;63;2014;29;155041390,38;37372642,978;22733684200,976;1,41955340585731;0,00233365002154078;1;167;26;-0,0670669125439501;-0,641199790508108;0,235425287698463;-3,55265424216155;0;38,3950177166354;1,00559440459514;2,16489675121353;-0,435701412394878;0,241200311407837
2024;"ZAF";2906;"Alcohols; cyclic, and their halogenated, sulphonated, nitrated or nitrosated derivatives";"Organic chemicals";1519,875;63;2014;29;155041390,38;2345576,65;22733684200,976;0,0950124266517095;9,80302741271121e-06;0;167;15;-0,0670669125439501;0,76917818932441;0,123881204123135;-3,55265424216155;0,322837721493369;34,1746727741676;-0,230746178868187;-0,842526935034604;1,07720809188442;0,155142445239333
2024;"ZAF";2907;"Phenols; monophenols, polyphenols, and phenol-alcohols";"Organic chemicals";44516,562;63;2014;29;155041390,38;5675640,28;22733684200,976;1,15008230821419;0,000287126952943932;1;167;18;-0,0670669125439501;1,34535947374101;0,166974645281512;-3,55265424216155;0;32,1392881723499;-0,827007532024791;0,319347648605877;-0,435701412394878;0,23688458941193
2024;"ZAF";2908;"Phenols or phenol-alcohols; halogenated, sulphonated, nitrated or nitrosated derivatives thereof";"Organic chemicals";92,4;63;2014;29;155041390,38;620665,398;22733684200,976;0,02182913895623;5,95969887612149e-07;0;167;7;-0,0670669125439501;0,877054161460288;0,120216652011802;-3,55265424216155;0,197249591884937;34,1454284270646;-0,239313244748637;-0,941329672623737;0,488666350137676;-0,0711166925791415
2024;"ZAF";2909;"Ethers, ether-alcohols, ether-phenols, ether-alcohol-phenols, alcohol peroxides, ether peroxides, ketone peroxides (chemically defined or not); halogenated, sulphonated, nitrated, nitrosated derivative";"Organic chemicals";6226,829;63;2014;29;155041390,38;16738761,467;22733684200,976;0,0545463616045031;4,01623655769489e-05;0;167;12;-0,0670669125439501;0,286189887248749;0,132109974856982;-3,55265424216155;0,172314393439988;34,1153798501759;-0,248115907940664;-0,620664876371811;0,37181290889807;-0,0002453531776923
2024;"ZAF";2910;"Epoxides, epoxyalcohols, epoxyphenols and epoxyethers; with a three-membered ring and their halogenated, sulphonated, nitrated or nitrosated derivatives";"Organic chemicals";357,762;63;2014;29;155041390,38;3242844,119;22733684200,976;0,016176713918562;2,30752574601621e-06;0;167;10;-0,0670669125439501;1,69258130589672;0,125546249935075;-3,55265424216155;0,467472601811334;29,6690537829505;-1,55065715496185;-0,797634386250204;1,75500833180416;0,836010366838601
2024;"ZAF";2912;"Aldehydes, whether or not with other oxygen function; cyclic polymers of aldehydes; paraformaldehyde";"Organic chemicals";1936,618;63;2014;29;155041390,38;2653592,342;22733684200,976;0,107011863608322;1,24909741537626e-05;0;167;14;-0,0670669125439501;1,37754217374068;0,126498989288691;-3,55265424216155;0,484481774778647;32,3035007180143;-0,778901835147804;-0,77194686606048;1,83471816039278;0,613891043160035
2024;"ZAF";2914;"Ketones and quinones; whether or not with other oxygen function, and their halogenated, sulphonated, nitrated or nitrostated derivatives";"Organic chemicals";194417,43;63;2014;29;155041390,38;6931552,843;22733684200,976;4,11269807502932;0,00125397114617904;1;167;16;-0,0670669125439501;1,42509097597069;0,155115401848172;-3,55265424216155;0;35,9022239948943;0,275336075855551;-0,000398307066649758;-0,435701412394878;-0,237145265105693
2024;"ZAF";2915;"Acids; saturated acyclic monocarboxylic acids and their anhydrides, halides, peroxides and peroxyacids; their halogenated, sulphonated, nitrated or nitrosated derivatives";"Organic chemicals";54037,732;63;2014;29;155041390,38;15898231,047;22733684200,976;0,498391328323254;0,000348537457433501;0;167;17;-0,0670669125439501;0,958854691321131;0,136614580223545;-3,55265424216155;0,305999520272898;32,688601755638;-0,666087350066955;-0,499212832996931;0,998299485592754;0,388391334220926
2024;"ZAF";2916;"Acids; unsaturated acyclic monocarboxylic, cyclic monocarboxylic , their anhydrides, halides, peroxides and peroxyacids; their halogenated, sulphonated, nitrated or nitrosated derivatives";"Organic chemicals";79946,226;63;2014;29;155041390,38;10647365,788;22733684200,976;1,10097627629574;0,000515644408270947;1;167;16;-0,0670669125439501;1,13348833615147;0,153098578796532;-3,55265424216155;0;34,1403071536618;-0,240813510303512;-0,0547753858148673;-0,435701412394878;-0,0832210959687443
2024;"ZAF";2917;"Acids; polycarboxylic acids, their anhydrides, halides, peroxides and peroxy-acids; their halogenated, sulphonated, nitrated or nitrosated derivatives";"Organic chemicals";3835,777;63;2014;29;155041390,38;17883083,513;22733684200,976;0,0314509026586186;2,47403418570916e-05;0;167;11;-0,0670669125439501;1,11236197873382;0,124096790848726;-3,55265424216155;0,284031606800083;30,462511403708;-1,3182155249118;-0,836714339653467;0,895351586789393;0,458950924015908
2024;"ZAF";2918;"Acids; carboxylic acid with additional oxygen function and their anhydrides, halides, peroxides, peroxyacids; their halogenated, sulphonated, nitrated or nitrosated derivatives";"Organic chemicals";20330,725;63;2014;29;155041390,38;10051321,802;22733684200,976;0,296586826377643;0,000131130951226445;0;167;18;-0,0670669125439501;0,629681020073195;0,142296095153629;-3,55265424216155;0,239293284463193;38,041682628333;0,902085683107922;-0,346029248293686;0,685695067235553;-0,187473288055352
2024;"ZAF";2919;"Esters; phosphoric, and their salts, including lactophosphates, their halogenated, sulphonated, nitrated or nitrosated derivatives";"Organic chemicals";154,849;63;2014;29;155041390,38;935532,98;22733684200,976;0,0242700947248564;9,98759103104478e-07;0;167;8;-0,0670669125439501;1,42161632534735;0,109561417150594;-3,55265424216155;0,37662206610211;32,6504753468007;-0,677256396007497;-1,22861345027469;1,32925684803223;0,259299931255012
2024;"ZAF";2920;"Esters of other inorganic acids of non-metals (other than of hydrogen halides) and their salts, their halogenated, sulphonated, nitrated or nitrosated derivatives";"Organic chemicals";788,384;63;2014;29;155041390,38;1918123,919;22733684200,976;0,0602675184116329;5,08499051813005e-06;0;167;10;-0,0670669125439501;1,44048917338366;0,109166474698218;-3,55265424216155;0,388141480715367;31,9083996324519;-0,89464581183932;-1,23926178990786;1,38324010553855;0,346208042490004
2024;"ZAF";2921;"Amine-function compounds";"Organic chemicals";5933,025;63;2014;29;155041390,38;11064530,709;22733684200,976;0,0786258490513736;3,82673619312779e-05;0;167;16;-0,0670669125439501;1,29008192606401;0,125976875424623;-3,55265424216155;0,452380058727791;31,5851313727674;-0,989346523331371;-0,786023969492472;1,68428037669032;0,629200976843072
2024;"ZAF";2922;"Oxygen-function amino-compounds";"Organic chemicals";7124,821;63;2014;29;155041390,38;16677491,888;22733684200,976;0,0626419672573392;4,5954315699423e-05;0;167;10;-0,0670669125439501;1,25659031755953;0,112013404285806;-3,55265424216155;0,32658697638388;32,3255614044724;-0,772439206538285;-1,16250358633168;1,09477816805637;0,234904596087659
2024;"ZAF";2923;"Quaternary ammonium salts and hydroxides; lecithins and other phosphoaminolipids, whether or not chemically defined";"Organic chemicals";8269,961;63;2014;29;155041390,38;2878866,146;22733684200,976;0,42121531878564;5,33403433736673e-05;0;167;19;-0,0670669125439501;0,434952877531706;0,144767024784476;-3,55265424216155;0,231267696544437;33,5845312272155;-0,403626821192663;-0,279408661520536;0,64808487663097;0,257434345434365
2024;"ZAF";2924;"Carboxyamide-function compounds; amide-function compounds of carbonic acid";"Organic chemicals";690,435;63;2014;29;155041390,38;8573290,015;22733684200,976;0,0118085739064887;4,45323018780838e-06;0;167;9;-0,0670669125439501;1,26116355599916;0,109419149312774;-3,55265424216155;0,342968889354868;31,3088235251844;-1,07029028744381;-1,23244924013944;1,17154847766405;0,336463174989475
2024;"ZAF";2925;"Carboxyimide-function compounds (including saccharin and its salts) and imine-function compounds";"Organic chemicals";2698,602;63;2014;29;155041390,38;2516785,34;22733684200,976;0,157222548155798;1,74056875611463e-05;0;167;11;-0,0670669125439501;1,28318669102586;0,113582323352998;-3,55265424216155;0,433115526212995;32,3957116024512;-0,751888863407208;-1,12020278279966;1,5940012909555;0,408562457187683
2024;"ZAF";2926;"Nitrile-function compounds";"Organic chemicals";291,077;63;2014;29;155041390,38;4324210,857;22733684200,976;0,00987013733953855;1,87741479411777e-06;0;167;13;-0,0670669125439501;1,71735950121271;0,11657571416793;-3,55265424216155;0,542146905008665;31,3069361676748;-1,07084318459235;-1,03949572823908;2,10495338317572;0,712100279842998
2024;"ZAF";2927;"Diazo-, azo- or azoxy-compounds";"Organic chemicals";21,555;63;2014;29;155041390,38;583836,554;22733684200,976;0,00541350962079917;1,39027390990042e-07;0;167;6;-0,0670669125439501;0,984359873837611;0,0987796623883549;-3,55265424216155;0,207472319421408;34,655742020971;-0,0898180221921023;-1,51930842585696;0,536572962717031;-0,297639146982608
2024;"ZAF";2928;"Organic derivatives of hydrazine or of hydroxylamine";"Organic chemicals";587,778;63;2014;29;155041390,38;1560020,725;22733684200,976;0,0552465454858175;3,79110377273695e-06;0;167;8;-0,0670669125439501;1,03853411989379;0,107632321951577;-3,55265424216155;0,326555982781442;33,9928060921246;-0,284023615394053;-1,2806252325996;1,09463292320864;0,0326771020010328
2024;"ZAF";2929;"Nitrogen-function compounds, n.e.c. in chapter 29";"Organic chemicals";10104,555;63;2014;29;155041390,38;5972836,176;22733684200,976;0,248061152753948;6,51732738930821e-05;0;167;10;-0,0670669125439501;1,39187884708801;0,114372535356812;-3,55265424216155;0,438490356177368;31,8308939064683;-0,917350940398867;-1,09889728437022;1,61918927487315;0,4792143103006
2024;"ZAF";2930;"Organo-sulphur compounds";"Organic chemicals";34376,805;63;2014;29;155041390,38;9247363,408;22733684200,976;0,545091931942824;0,000221726630003407;0;167;13;-0,0670669125439501;0,495254585699469;0,129871135953508;-3,55265424216155;0,227892949305239;34,3434008141735;-0,181317678053374;-0,681027890995124;0,632269849969571;0,0441865456759404
2024;"ZAF";2931;"Organo-inorganic compounds; n.e.c. in heading no. 2930";"Organic chemicals";811,035;63;2014;29;155041390,38;7588002,562;22733684200,976;0,0156723562845414;5,23108698917229e-06;0;167;9;-0,0670669125439501;1,72519708479639;0,113014618822503;-3,55265424216155;0,492620635048305;31,7915603879263;-0,928873606419485;-1,13550909037847;1,87285917749267;0,555407897844558
2024;"ZAF";2932;"Heterocyclic compounds with oxygen hetero-atom(s) only";"Organic chemicals";26103,26;63;2014;29;155041390,38;10064697,567;22733684200,976;0,380291123247579;0,000168363170221977;0;167;13;-0,0670669125439501;1,05824081473255;0,116289981659391;-3,55265424216155;0,361250168360994;37,8857438036446;0,856403754230525;-1,0471995766779;1,25721975743524;-0,215461191157728
2024;"ZAF";2933;"Heterocyclic compounds with nitrogen hetero-atom(s) only";"Organic chemicals";10123,334;63;2014;29;155041390,38;94448445,563;22733684200,976;0,0157163220498459;6,52943963878815e-05;0;167;8;-0,0670669125439501;1,4064341695958;0,112054004438538;-3,55265424216155;0,267838718631946;32,0063052352004;-0,865964585144231;-1,16140893516707;0,819467101240484;0,174674250405882
2024;"ZAF";2934;"Nucleic acids and their salts, whether or not chemically defined; other heterocyclic compounds";"Organic chemicals";4927,949;63;2014;29;155041390,38;30961327,842;22733684200,976;0,023338277260257;3,17847317282295e-05;0;167;14;-0,0670669125439501;1,3962868328265;0,126158243557374;-3,55265424216155;0,362538141818143;31,3917743517031;-1,04599002889741;-0,781133967254051;1,26325556785902;0,50937054316746
2024;"ZAF";2935;"Sulphonamides";"Organic chemicals";358,602;63;2014;29;155041390,38;8404547,315;22733684200,976;0,00625634298146958;2,31294365408541e-06;0;167;8;-0,0670669125439501;1,53065168562529;0,121293310755653;-3,55265424216155;0,218489011373656;31,0158947800029;-1,15610310622234;-0,912301068824442;0,588200318662844;0,277334118686914
2024;"ZAF";2936;"Provitamins, vitamins; natural or reproduced by synthesis (including natural concentrates) derivatives thereof used as vitamins, and intermixtures of the fore-going, whether or not in any solvent";"Organic chemicals";28858,847;63;2014;29;155041390,38;9121789,489;22733684200,976;0,463896502989232;0,000186136404796604;0;167;10;-0,0670669125439501;1,17799133798929;0,111600213285375;-3,55265424216155;0,364679945674467;31,7616690897028;-0,937630195179386;-1,17364393875389;1,27329267069677;0,345759642374091
2024;"ZAF";2937;"Hormones, prostaglandins, thromboxanes and leukotrienes, natural or reproduced by synthesis; derivatives and structural analogues thereof, including chain modified polypeptides, used primarily as hormones.";"Organic chemicals";1258,572;63;2014;29;155041390,38;39310031,048;22733684200,976;0,00469458111260577;8,1176516600844e-06;0;167;8;-0,0670669125439501;1,34096342769109;0,130838946545871;-3,55265424216155;0,261655065632245;30,7902874565627;-1,22219426552283;-0,654934023835341;0,790488742233558;0,452582994640349
2024;"ZAF";2938;"Glycosides, natural or reproduced by synthesis, and their salts, ethers, esters and other derivatives";"Organic chemicals";449,384;63;2014;29;155041390,38;1699204,172;22733684200,976;0,0387787859367381;2,89847761877379e-06;0;167;14;-0,0670669125439501;-0,158070975136097;0,128897078244601;-3,55265424216155;0,0978228142965672;34,8888965271026;-0,0215159326526411;-0,707290191348877;0,0227241544813425;-0,221016701404965
2024;"ZAF";2939;"Alkaloids, vegetable; natural or reproduced by synthesis, and their salts, ethers, esters and other derivatives";"Organic chemicals";1402,565;63;2014;29;155041390,38;2469990,293;22733684200,976;0,0832625905782632;9,04639075128501e-06;0;167;18;-0,0670669125439501;0,554490478467185;0,1440521924282;-3,55265424216155;0,237920758760425;35,6700858472359;0,20733172625084;-0,298681792744114;0,679263020909059;0,0577498339713682
2024;"ZAF";2940;"Sugars, chemically pure, other than sucrose, lactose, maltose, glucose and fructose; sugar ethers, sugar acetals and sugar esters, and their salts, other than the products of heading 29.37, 29.38, or 29.39";"Organic chemicals";8070,669;63;2014;29;155041390,38;1556965,874;22733684200,976;0,760068284124414;5,20549317844682e-05;0;167;15;-0,0670669125439501;1,30893741514608;0,117488834886236;-3,55265424216155;0,460733546235537;32,8378545090155;-0,62236409078136;-1,01487639578669;1,72342719815184;0,443638297715503
2024;"ZAF";2941;"Antibiotics";"Organic chemicals";535,761;63;2014;29;155041390,38;11319826,335;22733684200,976;0,00693990460691129;3,45559981555165e-06;0;167;13;-0,0670669125439501;1,01581840152914;0,118265447896909;-3,55265424216155;0,300985494519968;31,8176305315133;-0,92123641633842;-0,993937550009463;0,974802332963813;0,300700399764257
2024;"ZAF";2942;"Organic compounds; n.e.c. in chapter 29";"Organic chemicals";1118,278;63;2014;29;155041390,38;1074746,494;22733684200,976;0,152568863953407;7,21277071405995e-06;0;167;16;-0,0670669125439501;0,404836309936985;0,137395694961378;-3,55265424216155;0,168878013534405;34,7330359589097;-0,0671749364652359;-0,47815261277781;0,355709054009546;-0,0184228741010092
2024;"ZAF";3001;"Glands and other organs (extracts, secretions thereof) for organo-therapeutic uses, dried, powdered or not; heparin and its salts; other human or animal substances for therapeutic or prophylactic uses n.e.c.";"Pharmaceutical products";2960,223;63;2014;30;155041390,38;3698339,84;22733684200,976;0,117365318354474;1,90931143789708e-05;0;167;15;-0,0670669125439501;0,548136425781276;0,137892344480687;-3,55265424216155;0,214176858136345;33,8712420584877;-0,319635526345299;-0,464762072641049;0,567992340529252;0,140955264744501
2024;"ZAF";3002;"Blood, human or animal; for therapeutic, prophylactic or diagnostic uses; antisera, other blood fractions, modified immunological products, (from biotechnological processes or not); vaccines, toxins, micro-organism cultures (not yeasts), similar products";"Pharmaceutical products";55335,07;63;2014;30;155041390,38;359514998,714;22733684200,976;0,0225686519274095;0,000356905145550979;0;167;16;-0,0670669125439501;1,56445781411057;0,13004628887232;-3,55265424216155;0,483095340941289;29,8600924590684;-1,49469280334714;-0,676305461800616;1,82822093658668;0,882202759377735
2024;"ZAF";3003;"Medicaments; (not goods of heading no. 3002, 3005 or 3006) of two or more constituents mixed together for therapeutic or prophylactic use not in measured doses or in forms or packings for retail sale";"Pharmaceutical products";94608,638;63;2014;30;155041390,38;16733374,276;22733684200,976;0,829028448336118;0,000610215360995655;0;167;24;-0,0670669125439501;0,708352679498753;0,146991318170286;-3,55265424216155;0,184213517751206;32,2628024713183;-0,790824295219673;-0,219437819506916;0,427575594187039;0,332987356633265
2024;"ZAF";3004;"Medicaments; (not goods of heading no. 3002, 3005 or 3006) consisting of mixed or unmixed products for therapeutic or prophylactic use, put up in measured doses (incl. those in the form of transdermal admin. systems) or packed for retail sale";"Pharmaceutical products";352940,338;63;2014;30;155041390,38;488974544,131;22733684200,976;0,105836925463899;0,00227642655380578;0;167;32;-0,0670669125439501;0,703847582422347;0,160257470911212;-3,55265424216155;0,177651049249159;30,8907121067614;-1,19277508952813;0,138240873074777;0,396821997852776;0,575945986818561
2024;"ZAF";3005;"Wadding, gauze, bandages (dressings, adhesive plasters, poultices), impregnated or coated with pharmaceutical substances or in forms or packings for retail sale, for medical, surgical or veterinary use";"Pharmaceutical products";36910,004;63;2014;30;155041390,38;10620778,543;22733684200,976;0,509577105214944;0,000238065486316493;0;167;21;-0,0670669125439501;0,672318944894376;0,1493745424494;-3,55265424216155;0,259247688315739;30,2271606336382;-1,38716100504512;-0,155181922493707;0,779207086528393;0,670395389693268
2024;"ZAF";3006;"Pharmaceutical goods";"Pharmaceutical products";10784,605;63;2014;30;155041390,38;20606826,299;22733684200,976;0,0767388525837851;6,95595219674397e-05;0;167;24;-0,0670669125439501;0,793113226275306;0,15318559976764;-3,55265424216155;0,279074591788198;32,5921686875262;-0,694337201043533;-0,0524291481541864;0,87212160272915;0,504676551872832
2024;"ZAF";3101;"Fertilizers; animal or vegetable, whether or not mixed together or chemically treated; fertilizers produced by the mixing or chemical treatment of animal or vegetable products";"Fertilizers";14647,065;63;2014;31;155041390,38;1258154,082;22733684200,976;1,70702132385614;9,44719662543057e-05;1;167;29;-0,0670669125439501;-0,404357712029441;0,198018787423837;-3,55265424216155;0;34,5750752427841;-0,113449173903472;1,15635204548213;-0,435701412394878;0,278033268996909
2024;"ZAF";3102;"Fertilizers; mineral or chemical, nitrogenous";"Fertilizers";271092,222;63;2014;31;155041390,38;34453601,186;22733684200,976;1,15373111001567;0,00174851516318039;1;167;35;-0,0670669125439501;-1,26649172052799;0,237747630647606;-3,55265424216155;0;35,5968354869892;0,185873197537933;2,22751118103335;-0,435701412394878;0,535312190366848
2024;"ZAF";3103;"Fertilizers; mineral or chemical, phosphatic";"Fertilizers";8658,118;63;2014;31;155041390,38;3732464,955;22733684200,976;0,340133908916493;5,58439135432114e-05;0;167;17;-0,0670669125439501;-1,37500056003128;0,176954828172506;-3,55265424216155;-0,193597047615547;35,524610726239;0,164715115896822;0,588430843853916;-1,34295231226839;-0,306412194770431
2024;"ZAF";3104;"Fertilizers; mineral or chemical, potassic";"Fertilizers";41344,491;63;2014;31;155041390,38;20892952,638;22733684200,976;0,290161640700411;0,000266667442149908;0;167;14;-0,0670669125439501;-1,19784299787469;0,180698852205746;-3,55265424216155;-0,0638753000028488;29,3875945700128;-1,63310999999897;0,68937628352705;-0,735039259335375;0,529149008063548
2024;"ZAF";3105;"Fertilizers; mineral or chemical, containing 2 or 3 of the elements nitrogen, phosphorus, potassium; other fertilisers; goods of chapter 31 in tablets or packages of gross weight not exceeding 10kg";"Fertilizers";255911,981;63;2014;31;155041390,38;36934949,048;22733684200,976;1,01595689675817;0,00165060427007763;1;167;31;-0,0670669125439501;-1,11522716897658;0,233366170647924;-3,55265424216155;0;37,2884644001519;0,681432092844721;2,10937935224394;-0,435701412394878;0,330748615668115
2024;"ZAF";3202;"Tanning substances; synthetic organic or inorganic tanning substances; tanning preparations, whether or not containing natural tanning substances, enzymatic preparations for pre-tanning";"Tanning or dyeing extracts; tannins and their derivatives; dyes, pigments and other colouring matter; paints, varnishes; putty, other mastics; inks";39205,826;63;2014;32;155041390,38;572757,519;22733684200,976;10,0369550077899;0,000252873286958458;1;167;16;-0,0670669125439501;-0,247372903796581;0,181476397718582;-3,55265424216155;0;36,963153855534;0,586133098562889;0,7103402711944;-0,435701412394878;-0,103831413254456
2024;"ZAF";3203;"Colouring matter of vegetable or animal origin (including dyeing extracts, not animal black); whether or not chemically defined; preparations based on colouring matter of vegetable or animal origin";"Tanning or dyeing extracts; tannins and their derivatives; dyes, pigments and other colouring matter; paints, varnishes; putty, other mastics; inks";1083,258;63;2014;32;155041390,38;1856819,969;22733684200,976;0,0855429603061611;6,98689554669872e-06;0;167;20;-0,0670669125439501;0,423472617510381;0,140972603050694;-3,55265424216155;0,233687702834386;34,6232769901251;-0,0993285801501192;-0,381712911392152;0,659425715302311;0,125680461353426
